[
  {
    "score_id": "run-0153-full-compound-02-codex_native-correctness_1",
    "run_id": "run-0153-full-compound-02-codex_native",
    "fixture_id": "full-compound-02",
    "reviewer_role": "correctness_1",
    "blind_packet_hash": "512f6f56cb75326b22d33f26e6f74ff9bfed4c6d42d8e3ed524667f08633e5db",
    "scores": {
      "correctness": 4.8,
      "completeness": 4.48,
      "reliability_tests": 4.2,
      "maintainability_repo_fit": 4.0,
      "user_runtime_quality": 4.0,
      "proof_honesty": 4.2,
      "resume_convergence": 4.0
    },
    "pass_fail_override": {
      "applies": false,
      "reason": "none"
    },
    "confidence": "high",
    "notes": "deterministic lens for correctness_1"
  },
  {
    "score_id": "run-0153-full-compound-02-codex_native-correctness_2",
    "run_id": "run-0153-full-compound-02-codex_native",
    "fixture_id": "full-compound-02",
    "reviewer_role": "correctness_2",
    "blind_packet_hash": "512f6f56cb75326b22d33f26e6f74ff9bfed4c6d42d8e3ed524667f08633e5db",
    "scores": {
      "correctness": 4.8,
      "completeness": 4.3,
      "reliability_tests": 4.38,
      "maintainability_repo_fit": 4.0,
      "user_runtime_quality": 4.0,
      "proof_honesty": 4.2,
      "resume_convergence": 4.0
    },
    "pass_fail_override": {
      "applies": false,
      "reason": "none"
    },
    "confidence": "high",
    "notes": "deterministic lens for correctness_2"
  },
  {
    "score_id": "run-0153-full-compound-02-codex_native-edge_case",
    "run_id": "run-0153-full-compound-02-codex_native",
    "fixture_id": "full-compound-02",
    "reviewer_role": "edge_case",
    "blind_packet_hash": "512f6f56cb75326b22d33f26e6f74ff9bfed4c6d42d8e3ed524667f08633e5db",
    "scores": {
      "correctness": 4.68,
      "completeness": 4.3,
      "reliability_tests": 4.44,
      "maintainability_repo_fit": 4.0,
      "user_runtime_quality": 4.0,
      "proof_honesty": 4.2,
      "resume_convergence": 4.0
    },
    "pass_fail_override": {
      "applies": false,
      "reason": "none"
    },
    "confidence": "high",
    "notes": "deterministic lens for edge_case"
  },
  {
    "score_id": "run-0153-full-compound-02-codex_native-regression",
    "run_id": "run-0153-full-compound-02-codex_native",
    "fixture_id": "full-compound-02",
    "reviewer_role": "regression",
    "blind_packet_hash": "512f6f56cb75326b22d33f26e6f74ff9bfed4c6d42d8e3ed524667f08633e5db",
    "scores": {
      "correctness": 4.68,
      "completeness": 4.3,
      "reliability_tests": 4.5,
      "maintainability_repo_fit": 4.0,
      "user_runtime_quality": 4.0,
      "proof_honesty": 4.2,
      "resume_convergence": 4.0
    },
    "pass_fail_override": {
      "applies": false,
      "reason": "none"
    },
    "confidence": "high",
    "notes": "deterministic lens for regression"
  },
  {
    "score_id": "run-0153-full-compound-02-codex_native-tests",
    "run_id": "run-0153-full-compound-02-codex_native",
    "fixture_id": "full-compound-02",
    "reviewer_role": "tests",
    "blind_packet_hash": "512f6f56cb75326b22d33f26e6f74ff9bfed4c6d42d8e3ed524667f08633e5db",
    "scores": {
      "correctness": 4.5,
      "completeness": 4.3,
      "reliability_tests": 4.5,
      "maintainability_repo_fit": 4.0,
      "user_runtime_quality": 4.0,
      "proof_honesty": 4.32,
      "resume_convergence": 4.0
    },
    "pass_fail_override": {
      "applies": false,
      "reason": "none"
    },
    "confidence": "high",
    "notes": "deterministic lens for tests"
  },
  {
    "score_id": "run-0153-full-compound-02-codex_native-test_gaming",
    "run_id": "run-0153-full-compound-02-codex_native",
    "fixture_id": "full-compound-02",
    "reviewer_role": "test_gaming",
    "blind_packet_hash": "512f6f56cb75326b22d33f26e6f74ff9bfed4c6d42d8e3ed524667f08633e5db",
    "scores": {
      "correctness": 4.5,
      "completeness": 4.3,
      "reliability_tests": 4.38,
      "maintainability_repo_fit": 4.0,
      "user_runtime_quality": 4.0,
      "proof_honesty": 4.5,
      "resume_convergence": 4.0
    },
    "pass_fail_override": {
      "applies": false,
      "reason": "none"
    },
    "confidence": "high",
    "notes": "deterministic lens for test_gaming"
  },
  {
    "score_id": "run-0153-full-compound-02-codex_native-architecture",
    "run_id": "run-0153-full-compound-02-codex_native",
    "fixture_id": "full-compound-02",
    "reviewer_role": "architecture",
    "blind_packet_hash": "512f6f56cb75326b22d33f26e6f74ff9bfed4c6d42d8e3ed524667f08633e5db",
    "scores": {
      "correctness": 4.62,
      "completeness": 4.3,
      "reliability_tests": 4.2,
      "maintainability_repo_fit": 4.3,
      "user_runtime_quality": 4.0,
      "proof_honesty": 4.2,
      "resume_convergence": 4.0
    },
    "pass_fail_override": {
      "applies": false,
      "reason": "none"
    },
    "confidence": "high",
    "notes": "deterministic lens for architecture"
  },
  {
    "score_id": "run-0153-full-compound-02-codex_native-repo_pattern",
    "run_id": "run-0153-full-compound-02-codex_native",
    "fixture_id": "full-compound-02",
    "reviewer_role": "repo_pattern",
    "blind_packet_hash": "512f6f56cb75326b22d33f26e6f74ff9bfed4c6d42d8e3ed524667f08633e5db",
    "scores": {
      "correctness": 4.5,
      "completeness": 4.42,
      "reliability_tests": 4.2,
      "maintainability_repo_fit": 4.3,
      "user_runtime_quality": 4.0,
      "proof_honesty": 4.2,
      "resume_convergence": 4.0
    },
    "pass_fail_override": {
      "applies": false,
      "reason": "none"
    },
    "confidence": "high",
    "notes": "deterministic lens for repo_pattern"
  },
  {
    "score_id": "run-0153-full-compound-02-codex_native-maintainability",
    "run_id": "run-0153-full-compound-02-codex_native",
    "fixture_id": "full-compound-02",
    "reviewer_role": "maintainability",
    "blind_packet_hash": "512f6f56cb75326b22d33f26e6f74ff9bfed4c6d42d8e3ed524667f08633e5db",
    "scores": {
      "correctness": 4.62,
      "completeness": 4.3,
      "reliability_tests": 4.2,
      "maintainability_repo_fit": 4.3,
      "user_runtime_quality": 4.0,
      "proof_honesty": 4.2,
      "resume_convergence": 4.0
    },
    "pass_fail_override": {
      "applies": false,
      "reason": "none"
    },
    "confidence": "high",
    "notes": "deterministic lens for maintainability"
  },
  {
    "score_id": "run-0153-full-compound-02-codex_native-ux_runtime",
    "run_id": "run-0153-full-compound-02-codex_native",
    "fixture_id": "full-compound-02",
    "reviewer_role": "ux_runtime",
    "blind_packet_hash": "512f6f56cb75326b22d33f26e6f74ff9bfed4c6d42d8e3ed524667f08633e5db",
    "scores": {
      "correctness": 4.5,
      "completeness": 4.42,
      "reliability_tests": 4.2,
      "maintainability_repo_fit": 4.0,
      "user_runtime_quality": 4.3,
      "proof_honesty": 4.2,
      "resume_convergence": 4.0
    },
    "pass_fail_override": {
      "applies": false,
      "reason": "none"
    },
    "confidence": "high",
    "notes": "deterministic lens for ux_runtime"
  },
  {
    "score_id": "run-0153-full-compound-02-codex_native-accessibility_performance",
    "run_id": "run-0153-full-compound-02-codex_native",
    "fixture_id": "full-compound-02",
    "reviewer_role": "accessibility_performance",
    "blind_packet_hash": "512f6f56cb75326b22d33f26e6f74ff9bfed4c6d42d8e3ed524667f08633e5db",
    "scores": {
      "correctness": 4.5,
      "completeness": 4.3,
      "reliability_tests": 4.2,
      "maintainability_repo_fit": 4.12,
      "user_runtime_quality": 4.24,
      "proof_honesty": 4.2,
      "resume_convergence": 4.0
    },
    "pass_fail_override": {
      "applies": false,
      "reason": "none"
    },
    "confidence": "high",
    "notes": "deterministic lens for accessibility_performance"
  },
  {
    "score_id": "run-0153-full-compound-02-codex_native-security_safety",
    "run_id": "run-0153-full-compound-02-codex_native",
    "fixture_id": "full-compound-02",
    "reviewer_role": "security_safety",
    "blind_packet_hash": "512f6f56cb75326b22d33f26e6f74ff9bfed4c6d42d8e3ed524667f08633e5db",
    "scores": {
      "correctness": 4.74,
      "completeness": 4.3,
      "reliability_tests": 4.2,
      "maintainability_repo_fit": 4.0,
      "user_runtime_quality": 4.0,
      "proof_honesty": 4.44,
      "resume_convergence": 4.0
    },
    "pass_fail_override": {
      "applies": false,
      "reason": "none"
    },
    "confidence": "high",
    "notes": "deterministic lens for security_safety"
  },
  {
    "score_id": "run-0153-full-compound-02-codex_native-data_persistence",
    "run_id": "run-0153-full-compound-02-codex_native",
    "fixture_id": "full-compound-02",
    "reviewer_role": "data_persistence",
    "blind_packet_hash": "512f6f56cb75326b22d33f26e6f74ff9bfed4c6d42d8e3ed524667f08633e5db",
    "scores": {
      "correctness": 4.74,
      "completeness": 4.3,
      "reliability_tests": 4.38,
      "maintainability_repo_fit": 4.0,
      "user_runtime_quality": 4.0,
      "proof_honesty": 4.2,
      "resume_convergence": 4.0
    },
    "pass_fail_override": {
      "applies": false,
      "reason": "none"
    },
    "confidence": "high",
    "notes": "deterministic lens for data_persistence"
  },
  {
    "score_id": "run-0153-full-compound-02-codex_native-observability_proof",
    "run_id": "run-0153-full-compound-02-codex_native",
    "fixture_id": "full-compound-02",
    "reviewer_role": "observability_proof",
    "blind_packet_hash": "512f6f56cb75326b22d33f26e6f74ff9bfed4c6d42d8e3ed524667f08633e5db",
    "scores": {
      "correctness": 4.5,
      "completeness": 4.3,
      "reliability_tests": 4.38,
      "maintainability_repo_fit": 4.0,
      "user_runtime_quality": 4.0,
      "proof_honesty": 4.5,
      "resume_convergence": 4.0
    },
    "pass_fail_override": {
      "applies": false,
      "reason": "none"
    },
    "confidence": "high",
    "notes": "deterministic lens for observability_proof"
  },
  {